;Level;Stance;Claim;Votes;Comments;Depth
481;1.2.7;con;Monarchy has a historic and cultural value that should be preserved.;['0', '6', '8', '0', '1']; 5;2
482;1.2.7.1;pro;Monarchies have an influence on the arts and pop culture.;['1', '0', '0', '0', '1']; ;3
483;1.2.7.1.1;pro;Monarchies influence beauty and fashion standards, as well as art and architecture.;['0', '0', '0', '0', '0']; ;4
484;1.2.7.1.1.1;pro;Different eras of monarchies, specifically the English monarchy, created new and different architecture styles.;['0', '0', '0', '0', '0']; ;5
485;1.2.7.1.1.1.1;pro;Under the reign of King Henry VIII, the Tudor design was in style, which is still used and adapted today.;['0', '0', '0', '0', '0']; ;6
486;1.2.7.1.1.1.2;pro;The Victorian era developed the Victorian style which features a prominent facade.;['0', '0', '0', '0', '0']; ;6
487;1.2.7.1.2;pro;Monarchs in Europe now contribute to pop culture.;['0', '0', '0', '0', '0']; 3;4
488;1.2.7.2;pro;Monarchies are repositories of tradition and continuity in ever changing times. In the swiftly changing currents of politics, they help remind a country of what it represents and where it came from.;['1', '1', '5', '9', '6']; ;3
489;1.2.7.2.1;pro;To claim monarchistic institutions should be abolished without considering the complex cultural ramifications is short-sighted and potentially damaging to a country's cultural identity.;['0', '0', '0', '0', '0']; 6;4
490;1.2.7.2.1.1;pro;"A monarchy serves as the highest assurance of stability for both institutions and inheritance; a constitutional monarch is a living embodiment to the respect for the law.";['0', '0', '0', '0', '1']; 1;5
491;1.2.7.2.1.1.1;pro;One cannot find a more clear sign of a government's legitimacy than a centuries long continuity of government.;['0', '0', '0', '0', '0']; 1;6
492;1.2.7.2.1.1.1.1;con;Continuity is no basis for legitimacy. Many atrocities continue.;['0', '0', '0', '0', '0']; ;7
493;1.2.7.2.1.1.2;con;Not all members of a monarchy are lawful (e.g. Charles I);['0', '0', '0', '0', '0']; 5;6
494;1.2.7.2.1.1.3;con;Political stability does not inherently mean legitimacy.;['0', '0', '0', '1', '0']; 5;6
495;1.2.7.2.1.1.3.1;pro;Non-royal dictatorships and other forms of non-democratic regimes are also long and stable forms of government and not inherently legitimate or good for its citizens.;['1', '0', '1', '8', '1']; ;7
496;1.2.7.2.1.1.3.1.1;pro;The 11 worst countries in the world for political rights and civil liberties are or have recently been autocratic.;['0', '0', '4', '5', '1']; ;8
497;1.2.7.2.1.1.3.1.3;con;Non-royal dictatorships that have only lasted as long as a single dictator's lifespan are not comparably stable to European monarchies such as the British one, stable since the Glorious Revolution 330 years ago.;['0', '0', '0', '0', '1']; ;8
498;1.2.7.2.1.1.3.2;con;Political stability leads to economic growth, which is often connected to the perception of legitimacy.;['0', '1', '1', '1', '0']; ;7
499;1.2.7.2.1.1.3.2.1;con;Perception of legitimacy is not the same as legitimacy.;['0', '0', '0', '0', '0']; 1;8
500;1.2.7.2.1.1.3.3;con;Government instability can easily lead to a lack of rule of law and an increase in human rights violations.;['0', '0', '10', '0', '0']; 3;7
501;1.2.7.2.1.1.3.3.1;pro;Conflict and war are more likely to occur in governments in transition than in established systems (democratic or authoritarian).;['0', '1', '7', '2', '0']; ;8
502;1.2.7.2.1.1.3.3.2;pro;In times of crisis, the ability of political leaders, the effectiveness of government structures and their stability are key factors to avoid conflict.;['0', '1', '8', '1', '0']; ;8
503;1.2.7.2.1.1.3.3.3;con;In long-established European democracies, the rise in political instability or even the prolonged lack of government have not recently lead to a weaker rule of law.;['0', '1', '7', '0', '2']; ;8
504;1.2.7.2.1.1.3.3.4;con;Research points that even if strong inequality is one of the main factors for conflict and violence, the longer and more stable a democracy is, the more equipped it is to avoid conflict and to strengthen the social contract.;['0', '0', '2', '1', '0']; 4;8
505;1.2.7.2.1.2;con;One can preserve something culturally important without continuing it. Preservation is not continuity. Abolition of monarchy doesn't erase its history.;['0', '0', '0', '0', '0']; ;5
506;1.2.7.2.1.2.1;pro;Having a monarchy is not necessary to ensure history continuity or to maintain the country's origins and what they represent.;['0', '0', '0', '0', '0']; 6;6
507;1.2.7.2.1.2.1.1;pro;The traditional values can be preserved without the royal family having any de facto power over the country. Be it as a merely honorary title or by the promotion of institutions with the intent of preserving the knowledge if those traditions.;['0', '0', '0', '0', '0']; 1;7
508;1.2.7.2.1.2.1.2;pro;Many European countries, like France, Greece, Germany and Austria no longer have monarchs, but their people can and do still have a national identity and a sense of historical and cultural heritage.;['0', '0', '0', '0', '0']; ;7
509;1.2.7.2.1.2.1.2.1;con;That they have national identities and a sense of heritage, does not mean they would not have stronger and better ones if their monarchies had been preserved.;['0', '0', '0', '0', '0']; ;8
510;1.2.7.2.1.2.1.2.2;con;The monarchy in France was abolished through uprising because the people were suffering because of it. When we abolish monarchy in peace time, this might have a very different outcome.;['0', '0', '0', '0', '0']; ;8
511;1.2.7.2.1.3;con;Reflection of culture is not an excuse to keep a monarchy, but a reason to investigate the culture.;['0', '0', '0', '0', '0']; 3;5
512;1.2.7.2.3;pro;Monarchies provide an emotional and personal bond.;['0', '0', '0', '0', '0']; 8;4
513;1.2.7.2.3.1;pro;They provide comfort and nostalgia to people in a time of hyper-change and uncertainty.;['0', '0', '0', '0', '0']; 5;5
514;1.2.7.2.3.1.1;pro;For example, in the terrorist attack in Norway, the Prime Minister reacted with reason, calm and severity. However, the King cried with the country on National TV and expressed the sadness and compassion the country felt, while showing an ethical way forward. People expect reason and political calm from a Prime Minister or President, so they can't be an expression of what the country feels.;['0', '0', '0', '0', '0']; 4;6
515;1.2.7.2.3.1.2;pro;Especially with national disasters and emergencies when there are familiar strong comforting and resolute presences. In The Kingdom of the Netherlands  the Monarchs have been a great support with some national disasters, hugging people, crying with people, being compassionate. For example, after the Bijlmer disaster.;['0', '0', '0', '0', '0']; 4;6
516;1.2.7.2.3.2;pro;The death of a monarch is a unifying time as citizens can recognise death happens to everyone yet despite the personal demise, the monarchic institution lives on, linking the past, present and future of a country and withstanding the test of time.;['0', '0', '0', '0', '0']; 8;5
517;1.2.7.2.3.2.1;con;This can be equally applied to a good politician.;['0', '0', '0', '0', '1']; ;6
518;1.2.7.2.3.2.1.1;pro;The assassination of United States President John F. Kennedy produced widespread national mourning.;['0', '0', '0', '0', '1']; ;7
519;1.2.7.2.3.2.3;con;Historically, the death of a monarch has not always been a unifying time but the contrary.;['0', '0', '0', '0', '1']; ;6
520;1.2.7.2.3.2.3.1;pro;The death of the viciously anti-Catholic Queen Elizabeth I was widely celebrated by British Catholics, who hoped that the next monarch would be less oppressive.;['0', '0', '0', '0', '1']; ;7
521;1.2.7.2.3.2.3.2;pro;"The death of a monarch is not inherently unifying. The deaths of many monarchs led to civil war (known as a ""war of succession"").";['0', '0', '0', '0', '1']; ;7
522;1.2.7.2.3.3;pro;Monarchs are able to grow emotional bonds with the citizens of a country, as citizens see their monarch being born, grow, reach the throne and die.;['0', '0', '0', '0', '0']; 1;5
523;1.2.7.2.6;con;In France, the excesses of monarchy and the Royal Court contributed to the French Revolution. Symbolically, the revolutionaries sent Louis XVI and Marie Antoinette to the guillotine.;['0', '8', '1', '1', '0']; ;4
524;1.2.7.2.6.1;con;The situation in France before the French Revolution of 1789 can hardly be used as an example for contemporary European monarchies.;['0', '1', '1', '8', '0']; 1;5
525;1.2.7.2.7;con;Continuity can be better represented in the form of a mostly unchanging piece of legislation or ultimate guidance for the country.;['0', '0', '0', '0', '0']; 3;4
526;1.2.7.2.7.1;pro;The US constitution has been amended several times to reflect modern values, yet the concept of inalienable rights, among others, remain and still hold the country together. It can last forever, unlike a monarch.;['0', '0', '0', '0', '0']; ;5
527;1.2.7.2.8;con;Traditions aren't always right or worth preserving, especially if they are harmful to the people and society.;['0', '0', '8', '1', '2']; 4;4
528;1.2.7.2.8.1;pro;The Succession to the Crown Act 2013 reversed 300 years of discriminatory and biased tradition, custom and law of the UK. It gave daughters and sons of the royal family equal rights to become Britain's monarch and allowed future monarchs to marry Catholics.;['0', '1', '8', '1', '0']; ;5
529;1.2.7.2.8.2;pro;Providing a 'repository of tradition and continuity' can be undesirable where the state (and indeed the monarch) has a history of, for example, colonialism and oppression.;['0', '0', '0', '9', '1']; ;5
530;1.2.7.2.8.3;con;Not all aspects of tradition are wrong either. Modern European monarchies have been legally reformed to not hold any oppressive power, but they retain the symbolism and tradition that helps with social trust and cohesion.;['0', '1', '8', '1', '0']; 5;5
531;1.2.7.2.8.3.1;pro;Social trust, an important sociological and economic factor which promotes cohesion, is higher in monarchies (pg.8);['0', '1', '8', '0', '0']; 10;6
532;1.2.7.2.8.3.1.1;pro;The social and political stability born out of the permanence of monarchy, as well that the unifying role and national conscience that monarchs play, are all possible explanations for their effect on societal trust.;['1', '0', '5', '4', '0']; ;7
533;1.2.7.2.8.3.1.2;pro;Multiple studies show there is strong, empirical support for the notion that monarchies have been able to create and sustain high levels of trust in society.;['1', '0', '2', '7', '0']; ;7
534;1.2.7.2.8.3.1.3;pro;The lasting example of a monarch, unlike temporary presidencies, provides a role model to its citizens which keeps them in check. (pg. 8);['1', '6', '3', '0', '0']; ;7
535;1.2.7.2.8.3.1.4;pro;A study found that, under control conditions, populations in monarchies are approximately ten percentage points more trusting than in other, similar countries.;['1', '0', '5', '4', '0']; ;7
536;1.2.7.2.8.3.1.5;con;Correlation is not causation. The permanence of a monarchy may rather be a reflection of these countries' long history of societal trust and peaceful political histories, rather than its direct cause. (pg.8);['0', '0', '3', '5', '2']; ;7
537;1.2.7.3;pro;Tourists come to spend and visit countries due to their monarchy and culture, abolishing monarchy will lose a great amount of income for countries like the United Kingdom etc.;['0', '0', '0', '0', '0']; 3;3
538;1.2.7.3.1;con;The tourism that constitutional monarchies receive is primarily due to the historic buildings and sites, and not due to the presence of the monarchy itself in the nation's current government.;['0', '0', '0', '0', '0']; 1;4
539;1.2.7.4;con;According to Immanuel Kant, an enlightened culture is one that does not rely on inherited traditions, authorities and social structures. To be enlightened is to question and challenge such aristocracies.;['3', '8', '5', '7', '3']; ;3
540;1.2.7.4.1;con;All cultures rely on inherited traditions to some extent, even if only traditions of language and logic, etc.;['0', '5', '4', '1', '1']; ;4
541;1.2.7.4.2;con;"Kant did not advocate the abolishment of monarchy per se; The philosopher solely highly pleaded for the separation of the executive power from the legislative power, and the rule of law.";['0', '1', '3', '1', '0']; ;4
542;1.2.7.5;con;Democracy has much more historic and cultural value.;['3', '4', '0', '2', '5']; ;3
543;1.2.7.6;con;Political systems change as cultural components change. Cultural and political transformation is a natural dynamic process.;['0', '1', '7', '6', '4']; ;3
544;1.2.7.6.1;pro;Monarchies are an imperial relic of an elitist past, a bygone age that has no place in the 21st century.;['0', '1', '8', '0', '1']; 4;4
545;1.2.7.6.1.1;con;In some instances, monarchs are able to offer symbolic actions of peace and apologies for past injustice more readily than elected politicians. This provides cathartic change from past injustice, when often parliament might have stayed silent.;['2', '1', '7', '2', '0']; 11;5
546;1.2.7.6.1.1.1;pro;In 2010, King Albert II of Belgium attended the 50th anniversary of Congolese independence, paying his respects and acknowledging the horrors committed under Belgian colonial rule.;['0', '0', '4', '0', '0']; 2;6
547;1.2.7.6.1.1.1.1;pro;"This move happened without parliamentary support, where the matter sparked ""heated debate"".";['0', '0', '6', '3', '0']; ;7
548;1.2.7.6.1.1.1.2;con;"Despite being a divisive issue, legislature did show an ability to act a full eight years previously, organising an ""unprecedented investigation into his country's murky colonial past""";['0', '0', '2', '7', '0']; ;7
549;1.2.7.6.1.1.2;pro;"Upon Ghana receiving independence in 1961, The Queen of England danced with the first Prime minister. Such an act of respect was described by the government directed local press  ""a fascinating change in the current relationship between Britain, the Common Wealth and Ghana"".";['0', '0', '0', '0', '0']; 3;6
550;1.2.7.6.1.1.3;pro;"In the UK, the Queen's candid remarks on the Troubles in Northern Ireland, offering her ""sincere thoughts and deep sympathy"" was vital in allowing both sides to enter the peace process which had been laid out in the 1998 agreement.";['0', '1', '8', '2', '1']; 1;6
551;1.2.7.6.1.1.3.1;pro;Even at present a failure to unequivocally condemn the IRA is politically dangerous. This may explain why politicians have proven unwilling to offer the same kind of unequivocal and wide reaching remarks that the Queen has.;['0', '0', '0', '0', '0']; ;7
552;1.2.7.6.1.1.4;pro;"A monarch's symbolic position as above electoral politics means that some consider their apology to ""go further"" than the words and actions of specific politicians.";['0', '1', '2', '9', '0']; 4;6
553;1.2.7.6.1.1.5;con;Monarchs are still extremely vulnerable to the effects of public opinion, meaning that the use of their power is implicitly determined by the will of the people.;['0', '0', '0', '0', '0']; 3;6
554;1.2.7.6.1.1.5.1;pro;King Leopold III of Belgium was forced to abdicate in favour of his son following widespread protests and a general strike.;['0', '1', '6', '3', '0']; ;7
555;1.2.7.6.1.1.5.2;pro;In 1936, King Edward VIII of the UK abdicated due to public pressure and widespread disapproval of his marriage.;['0', '0', '7', '3', '0']; 1;7
556;1.2.7.6.1.1.5.3;pro;A referendum held in Greece that saw 69% of people vote against the monarchy resulted in its abolition.;['0', '2', '4', '4', '0']; ;7
557;1.2.7.6.1.1.5.4;pro;In Liechtenstein, according to the Constitution, the Prince is subject to a popular vote of no confidence (Art. 13ter). Furthermore, the Constitution itself provides a procedure to abolish the monarchy upon popular request (Art. 113).;['0', '1', '2', '7', '0']; 1;7
558;1.2.7.6.1.1.5.5;pro;In 1976, when the public discovered that the Dutch Queen's husband accepted a bribe to influence the government's decision, he was forced to resign from a number of his positions of power.;['0', '0', '0', '0', '0']; ;7
559;1.2.7.6.1.1.5.6;pro;"When the UK Queen visited the site of the Amritsar massacre, her decision to stop short of a frank apology was made by political ""policy makers"", demonstrating how unwilling to cause political strife she was.";['0', '1', '6', '2', '0']; 1;7
560;1.2.7.6.1.1.5.7;con;Being subject to the pressure of public opinion is very different from representing the will of the people.;['0', '0', '5', '4', '1']; ;7
561;1.2.7.6.1.1.6;con;"In an effort to maintain the dignity of their position, many monarchs are unwilling to admit fault or apologise. King Juan Carlos' apology in 2012 was the ""the first public apology by a Spanish monarch in history""";['0', '1', '9', '1', '0']; ;6
562;1.2.7.6.1.2;con;When a monarchy is abolished, a monarch is just replaced with a person that does the same thing, with a different title and in a less meaningful and grand way.;['1', '0', '0', '0', '0']; 3;5
563;1.2.7.6.1.2.1;con;When a monarchy is abolished, the monarch is replaced by people who are elected as representatives of the people they rule. The fact that they perform similar functions is a reflection of the sovereignty of the people over themselves, instead of rule by a random, unelected, and unaccountable individual.;['0', '0', '0', '0', '1']; ;6
564;1.2.7.6.1.2.1.1;con;Even in European History, this is not always the case. Often this creates periods of instability, turmoil and even conflict and war, the results of which have influenced the political landscapes of today.;['0', '0', '0', '0', '0']; ;7
565;1.2.7.6.1.2.1.2;con;Usually when a monarchy is abolished, elected people come from the oligarchy. Even in constitutional monarchies  this can still be the case, look at the example of the British Tory party.  It could be argued this is no more representational of the common people than the nobility and monarchy.;['0', '0', '0', '0', '0']; 5;7
566;1.2.7.6.2;con;Change is natural, but is not a reason unto itself.;['0', '0', '0', '0', '1']; ;4
567;1.2.7.8;con;"Not all historical and cultural values and traditions are ""good"". The same logic could have been used to argue against abolishing slavery in the US or other parts of the world.";['1', '0', '0', '1', '6']; ;3
568;1.2.7.8.1;pro;The sole historical and cultural value of a monarchy lies in its origins, which are not worth celebrating.;['0', '0', '0', '0', '0']; 6;4
569;1.2.7.8.1.2;con;King Charles I,in his impassioned speech at his show trial, defended the rights of his subjects by rightfully stating the case that if a king was not allowed  his rights and property, nobody else was guaranteed safety either.;['0', '0', '0', '1', '0']; 6;5
570;1.2.7.8.1.3;con;The Monarchy traces its origins back to the very first forms of statehood. If anything they should be credited for their ability to unify different warring tribes, provide security and stability of its citizens and for the very first beginnings of governance.;['0', '0', '0', '0', '1']; ;5
571;1.2.7.8.2;con;Europe, which is, with the USA, the most advanced continent in respecting human rights. This means that Europe's traditions and cultural values have been tested by centuries of history and are good for the continent, or they would have been abolished by democracy.;['0', '0', '0', '0', '0']; ;4
572;1.2.8;con;Monarchies have been shown to be able to adapt to other government ideas and modernise to new times.;['1', '1', '4', '2', '1']; 2;2
573;1.2.8.1;pro;The United Kingdom is both a monarchy and a democracy since the XVII century, gradually expanding suffrage until today's universal suffrage. If the United Kingdom can have a balance of both monarchy and democracy, it means the monarchic institution can adapt and is not outdated.;['1', '0', '2', '0', '0']; 5;3
574;1.2.8.2;con;Through the adaptation monarchies have lost relevance as a governing force. There's no longer need for laws to acknowledge the modern monarchies.;['0', '0', '0', '0', '0']; ;3
575;1.2.9;con;In many former monarchies, the President of the Republic has many similar functions to royals and yet the institution of the presidency is not deemed as outdated.;['3', '2', '5', '3', '1']; 11;2
576;1.2.9.2;pro;"In Germany, a former monarchy, the President has similar prerogatives to monarchs: he or she is the de facto executive and symbolic nonpartisan figurehead; has veto and emergency powers; has prosecutorial immunity and cannot be voted out of office.";['0', '1', '0', '0', '0']; ;3
577;1.2.9.3;con;What matters is the legitimacy of the claim to power, not whether they perform similar duties. Monarchies are outdated because their flawed claim to legitimacy. Today, it is generally agreed that power derives from the consent of the governed.;['0', '0', '0', '0', '1']; 3;3
578;1.2.9.3.1;con;Monarchs do not have a legitimate claim because of the consent of the governed or because of the divine right to rule.  Monarchs have a claim to govern because they have legitimate claims to own large swaths of territory we call states/countries. Their ownership of land gives them the right to govern just as one's ownership of a house gives them the right to govern their own home, or just as the ownership of a car gives one the right to do as he wishes with his car.;['0', '0', '0', '0', '0']; ;4
579;1.2.9.3.1.1;con;In many countries what it was Crown land is nowadays considered public land and in some cases owned by the State. Therefore, if royals are legitimate because they own land, but they do not own it anymore or their profits and management are carried by the State, then monarchs no longer have that legitimisation.;['0', '0', '0', '0', '0']; ;5
580;1.2.9.3.1.2;con;Monarchs own land because historically they were the ultimate rulers of a nation, and their claim to power was legitimized by God. If we nowadays consider that historical legitimization out-dated, the fact that they own land (which steams from their historical divine right) should also not be considered legitimate.;['0', '0', '0', '0', '0']; ;5
581;1.2.9.4;con;Presidents of a Republic hold office by popular or parliamentary vote, and their political power rests upon the will of the People. By contrast, monarchs rule only by accident of birth, therefore even if they perform similar functions, they are not comparable in terms of being outdated.;['0', '0', '0', '0', '1']; ;3
582;1.2.9.4.1;pro;Democratic values, although ancient, are not considered outdated.;['0', '0', '0', '0', '1']; ;4
583;1.2.9.4.1.1;con;Subjective public perception doesn't alter the very real fact that democracy is just as old-fashioned and outmoded as monarchy is.;['0', '0', '0', '0', '0']; 1;5
584;1.2.9.4.1.1.1;con;Research generally supports that democratic principles are correlated with political stability, human rights and the necessary conditions for a prosperous economy.;['0', '0', '0', '0', '0']; ;6
585;1.2.9.4.1.1.2;con;Democracy may not an outdated model since the top 25 countries in the Human Development Index (HDI) are all well-established democracies.;['0', '0', '0', '0', '0']; ;6
586;1.2.9.4.1.1.2.1;pro;In continents with a lower overall development, like Africa, out of the ten most democratic countries, only 3 are in the Low Human Development while the least democratic ones, only 3 are above that level (and two are actually the last ones).;['0', '0', '0', '0', '0']; ;7
587;1.2.9.4.2;con;Presidents only represent the people who vote for them. They are naturally divisive figures. They cannot represent all the people of the nation in the same way that an impartial, unelected person can.;['0', '0', '0', '0', '0']; ;4
588;1.2.9.4.2.1;con;While monarchs may not be partisan in terms of politics (or at least not publicly) they are not impartial, they are the embodiment of a system that divides citizens by origin and that considers a specific lineage to be over the rest.;['0', '0', '0', '0', '0']; 3;5
589;1.2.9.4.2.1.1;pro;The roots of modern economic inequality can be traced to class and economic divisions enforced throughout history by monarchs for their own benefit.;['0', '0', '0', '0', '0']; 4;6
590;1.2.9.4.2.1.1.1;pro;Monarchies have a strong effect on the distribution of income and, over the years, have distorted the ratio between rules and producers in their favour, as well as that of their allies.;['0', '0', '1', '2', '1']; ;7
591;1.2.9.4.2.1.1.2;con;Because modern economic inequality originated in the aristocratic structures that produced the monarchy, does not mean that this is still the cause.;['0', '1', '0', '2', '0']; 1;7
592;1.2.9.4.2.1.1.2.1;pro;There is no reason to think that abolishing the monarchy would help with this problem.  The modern class divide has far more to do with regulatory and wealth capture by rich landowners than it does to any aristocratic heritage.;['0', '0', '0', '0', '0']; ;8
593;1.2.9.4.2.1.1.2.2;con;Even if monarchy were not the root of inequality or the cause of it nowadays, abolishing it could still be a step in the right direction if the goal is to achieve more equality.;['0', '0', '0', '0', '0']; ;8
594;1.2.9.4.2.1.2;pro;Monarchs in Europe have rarely varied in class, religion or race, meaning they are less representative of society.;['0', '0', '0', '0', '0']; ;6
595;1.2.9.4.2.1.2.1;pro;All 10 of Europe's hereditary monarchs since 1939 are descendants of a common ancestor, which does not allow for much diversity.;['0', '1', '6', '3', '1']; ;7
596;1.2.9.4.2.1.2.2;con;"Being ""representative of society"" is neither a necessary nor sufficient condition for being an effective political figure.";['0', '0', '0', '0', '1']; ;7
597;1.2.9.4.2.1.2.2.1;con;In a representative democracy, elected officials by definition represent the citizens they govern, and thus sharing interests, values and characteristic with their constituents is vital to be effective political figures and represent their citizenship in the best possible way.;['1', '0', '0', '0', '0']; ;8
