;Level;Stance;Claim;Votes;Comments;Depth
0;1;None;Alien life has existed or does exist.;['6', '7', '16', '36', '44'];;0
1;1.1;pro;Scientific theories support the possibility of alien life.;['3', '2', '0', '0', '6']; 34;1
2;1.1.1;pro;The simulation hypothesis claims we exist as digital lifeforms within a network of information technology. If true, this could indicate the existence of extraterrestrial life.;['2', '0', '0', '2', '3']; 20;2
3;1.1.1.1;pro;Researchers and public figures argue that there is a 50-50 chance we are living in a simulation.;['0', '0', '0', '0', '0']; ;3
4;1.1.1.2;con;Other humans might be running the simulation outlined in the simulation theory.;['0', '1', '0', '0', '0']; ;3
5;1.1.2;pro;The astrophysicist Tomonori Totani has created an equation that may prove that life (RNA), statistically, emerged at least once in each unobservable area of the universe.;['0', '0', '1', '0', '1']; ;2
6;1.1.3;pro;If the Multiverse hypothesis is true, by necessity there is more than one Earth and thus, more than one human species.;['2', '0', '0', '1', '4']; 4;2
7;1.1.3.1;pro;In a multiverse, there are (close to) an infinite number of universes. This would drastically increase the odds of alien life.;['0', '0', '0', '0', '0']; ;3
8;1.1.3.1.1;con;While the odds of alien life would increase in some universe at some time, the odds of not finding them near humans or at a similar time also exponentially increase, meaning that life in the multiverse does not increase our odds overall of discovering alien life.;['0', '0', '0', '0', '1']; ;4
9;1.1.3.2;pro;Behavior of quantum particles - these particles at this atomic and subatomic level can appear to be in two places at once - may indicate the existence of other parallel universes.;['1', '0', '0', '0', '1']; ;3
10;1.1.3.2.1;con;Even if there were parallel universes, it is unclear whether life in those universes would count as alien.;['1', '0', '2', '1', '1']; ;4
11;1.1.3.3;pro;Scientists recently reported detecting signals from the birth of the universe which they believe may be signs of another universe ‘bumping’ against our own.;['0', '0', '1', '0', '0']; ;3
12;1.1.3.4;con;The logic underpinning the multiverse theory is flawed.;['0', '0', '0', '0', '0']; ;3
13;1.1.3.5;con;If the Multiverse hypothesis were true, then each human species would not be considered extraterrestrials by definition because they would be on their Earth.;['0', '0', '1', '0', '0']; ;3
14;1.1.4;con;Renowned astronomer Carl Sagan claims that while scientists are open to investigating the possibilities of the existence of extraterrestrial life, alternative explanations continue to fit our observations better.;['0', '1', '0', '0', '1']; 2;2
15;1.1.5;con;There is no conclusive empirical evidence that supports the existence of alien life.;['0', '1', '0', '0', '1']; ;2
16;1.2;pro;The resilient and adaptable nature of life suggests that life can thrive under conditions other than found on Earth.;['1', '0', '0', '1', '17']; 5;1
17;1.2.1;pro;Findings of so-called extremophiles have allowed scientists to scale back their list of requirements for potential (extraterrestrial) habitats.;['0', '1', '0', '2', '7']; 3;2
18;1.2.1.1;pro;Researchers discovered bacteria in Lake Whillans, which is buried 2,625 feet (800m) below the West Antarctic Ice Sheet.;['0', '2', '1', '6', '0']; ;3
19;1.2.1.2;pro;Three recently discovered multicellular animals living in the muck of the deep Mediterranean seafloor ('Loricifera') do not require oxygen to produce chemical energy.;['0', '0', '0', '0', '2']; ;3
20;1.2.1.3;pro;Tardigrades (also known as water bears) can survive without water for 120 years, freezing to -272.8 °C, heating to 151 °C, the vacuum of space, pressure six times as great as that felt at the bottom of the deepest ocean and doses of X-ray and gamma radiation that are lethal to other life forms.;['0', '1', '7', '9', '5']; 2;3
21;1.2.1.3.1;con;Researchers found that most meteorites would simply get too hot (on average around 1,648 °C), destroying most amino acids and organic material during entry to the Earth's atmosphere.;['0', '0', '0', '0', '0']; ;4
22;1.2.1.3.1.1;con;Life could have come before the atmosphere became too dense.;['0', '0', '0', '1', '0']; ;5
23;1.2.1.4;pro;Researchers found evidence of life in the driest location on Earth, the Atacama Desert. This discovery could have far-reaching implications for alien life (such as the search for life on Mars).;['0', '0', '3', '5', '0']; ;3
24;1.2.1.5;con;The environments life encounters outside Earth are much more extreme than those on Earth, for example, in terms of radiation and the absence of nutrients.;['0', '0', '0', '0', '0']; ;3
25;1.2.1.5.1;pro;Life on Earth emerged in a particularly unique set of conditions and then adapted to current conditions. This would not be available on most planets - life would need to initially emerge in conditions analogous to or more extreme than those that, in every case found so far, require unusual and complex coping mechanisms to survive. (p. 2);['0', '0', '0', '0', '0']; 3;4
26;1.2.1.5.1.1;con;The conditions on Earth when life started were extreme from our point of view today, for example there was no oxygen in the atmosphere, similar to many other planets and celestial bodies.;['0', '0', '9', '5', '1']; ;5
27;1.2.1.5.2;con;When life on Earth emerged, the conditions on the surface of the Earth were that of radiation and lack of nutrients, which suggests that if a small area of any number of potential habitable exoplanets has a source of heat, liquid water, minerals, and chemicals, it could very well lead to a similar outcome.;['0', '0', '0', '0', '0']; 1;4
28;1.2.2;pro;There is no evidence that life can only survive in one specific set of conditions.;['0', '1', '1', '1', '6']; 14;2
29;1.2.2.1;pro;Non-biological alien life may exist in other realms that are accessible by neurochemistry including DMT experiences.;['0', '0', '0', '0', '0']; 10;3
30;1.2.2.2;pro;"There is not a large enough data pool to assume anything about the probability of life occurring; our existence can be written off as sample bias.";['0', '0', '0', '0', '0']; ;3
31;1.2.2.3;pro;It is hypothetically possible for there to be types of biochemistry that are not water, oxygen, or carbon based.;['0', '0', '0', '0', '0']; 6;3
32;1.2.2.3.1;pro;Recent discoveries have not only shown that life is possible in arsenic-rich locations, but that arsenic can even be used in biological processes.;['0', '0', '0', '1', '0']; 2;4
33;1.2.2.3.2;pro;There may be lifeforms based on silicon or sulfide.;['0', '0', '0', '0', '2']; ;4
34;1.2.2.3.2.1;pro;Organisms, when genetically engineered to do so, have shown their ability to generate organo-silicon compounds.;['0', '0', '0', '0', '0']; ;5
35;1.2.2.3.2.2;con;"Hypotheses of silicon's use for forming life are greatly overstated; as it oxidises to a solid, and has a poor range of handedness in compound form, silicon is unlikely to be suitable for life.";['0', '0', '0', '0', '0']; ;5
36;1.2.2.3.3;pro;Methane-based, oxygen-free living cells could exist.;['0', '0', '0', '1', '0']; 4;4
37;1.2.2.3.4;con;These lifeforms are only hypothetical and have no evidence to support them.;['0', '1', '0', '0', '0']; 3;4
38;1.2.2.4;con;Currently, only water- and carbon-based lifeforms have been proven to exist.;['0', '0', '0', '0', '0']; 6;3
39;1.2.2.4.1;pro;Water is vital to the biochemistry of life.;['0', '0', '0', '0', '0']; ;4
40;1.2.2.4.1.1;pro;Water is necessary for life because of its ability to act as a solvent.;['0', '0', '0', '0', '0']; 4;5
41;1.2.2.4.1.1.1;pro;Life requires thousands of interacting molecules at a minimum, and without a solvent to put them into solution, many of these interactions could not occur. H2O is more soluble than any liquid known to man, real or hypothetical, which makes it uniquely suitable for developing life.;['0', '0', '0', '0', '0']; 2;6
42;1.2.2.5;con;There is a narrow band of optimal conditions in which biochemical activity is both vibrant and diverse. This decreases the probability of life creation/sustainability in many habitats.;['0', '0', '0', '0', '1']; 2;3
43;1.2.3;pro;Work in space has already proven that a set of conditions for the transport of lifeforms does not require ongoing support from Earth.;['0', '1', '1', '2', '4']; 5;2
44;1.2.3.1;pro;The International Space Station contains microbial creatures from its early days.;['0', '0', '0', '0', '0']; ;3
45;1.2.3.2;pro;Many plants have been grown in space.;['0', '0', '0', '0', '0']; ;3
46;1.2.3.3;con;Even though ongoing support from Earth is not required, Earth-like conditions are created for life to survive.;['0', '0', '0', '0', '0']; ;3
47;1.2.3.3.1;con;In evolutionary biology, abiogenesis, or informally the origin of life (OoL) is the natural process by which life has arisen from non-living matter.;['0', '0', '0', '0', '0']; 1;4
48;1.2.4;con;Complex life (especially civilizations) requires a more limited range of conditions, making it less likely.;['0', '0', '0', '0', '0']; 4;2
49;1.2.4.1;pro;While life on Earth emerged 3.5 billion years ago, it has only been complex for approx. 500 million years. This suggests that the development of complex life requires long term stable conditions.;['0', '0', '0', '0', '0']; ;3
50;1.2.5;con;The ability of life to survive after its formation is fully different from its ability to form in the first place.;['2', '0', '2', '0', '4']; 1;2
51;1.2.5.1;pro;"Organisms may compete for the same resources, and occupy the same ""niche"", thus eliminating one another.";['0', '0', '0', '0', '0']; 1;3
52;1.2.5.2;con;The Entire Galaxy once started out as nothing.According to the Big Bang Theory, the entire galaxy was created or formed from a space of nothing. Given that we as humans were able to form life from nothing at all it is entirely likely other species have done the same.;['0', '0', '0', '0', '0']; ;3
53;1.2.6;con;An ability or probability is not proof that something actually exists.;['1', '3', '0', '2', '1']; ;2
54;1.2.6.1;pro;It is impossible to prove many theories of science completely.;['0', '0', '0', '0', '0']; ;3
55;1.2.6.1.1;pro;Scientific theories often require falsifiability to make them reliable. As space is so large, it seems unlikely that this could be achieved.;['0', '0', '0', '0', '0']; 4;4
56;1.3;pro;The size, age, and properties of the observable universe allow for an extremely high number of planets on which life could emerge and thrive.;['1', '0', '0', '0', '25']; ;1
57;1.3.1;pro;The Panspermia Theory posits that life was transported to Earth on asteroids or comets and started somewhere else originally.;['0', '0', '0', '0', '0']; 25;2
58;1.3.1.1;pro;Essential ingredients for creating proteins, nucleotides, DNA, and RNA - like free oxygen, phosphorus, sugar, boron, molybdenum - were not freely accessible on the early Earth.;['4', '5', '12', '7', '3']; ;3
59;1.3.1.2;pro;Microbes, viruses and even worms can survive a journey through space. Some bacteria can even survive a relatively unprotected re-entry into Earth’s atmosphere.;['2', '2', '15', '9', '3']; ;3
60;1.3.1.2.2;con;The author of that study attributes their survival to the design of the locker in which they were stored. Meteorites have no such advantages.;['0', '1', '7', '7', '2']; ;4
61;1.3.1.2.2.1;con;A cave inside an iron meteoroid has similar characteristics as a metallic locker.;['0', '0', '0', '0', '0']; ;5
62;1.3.1.3;pro;"The constant thermal motion, radiation, and general ""hellish"" environment on the young Earth might have destroyed naked DNA and complex organic molecules. This increases the likelihood that life came from outer space, as it could not originate from the planet itself.";['1', '8', '13', '2', '2']; 10;3
63;1.3.1.3.1;con;Life may have formed naturally (abiogenesis) on Earth as early as 4 billion years ago, protected in a deep marine hydrothermal setting.;['0', '0', '0', '0', '0']; 7;4
64;1.3.1.3.2;con;The constant change and influx of energy would have created a chaotic system that had more opportunities to create self-replicating matter.;['0', '0', '0', '0', '1']; 1;4
65;1.3.1.3.3;con;Local variations could have introduced a distributed network of organism-friendly habitats, or reproductive islands.;['0', '0', '0', '1', '0']; ;4
66;1.3.1.3.4;con;Life may have started naturally (abiogenesis) on the surface of Earth about 3.7 billion years ago, after the last heavy bombardment of asteroids. It's uncertain when the heavy bombardment of asteroids ended, but probably it ended not later than 3.8 billion years ago with the Late Heavy Bombardment.;['0', '0', '0', '0', '0']; 7;4
67;1.3.1.4;con;The idea that life has come to Earth from space is improbable, compared to a simpler idea, that life was a product of early Earth conditions.;['1', '1', '0', '0', '1']; ;3
68;1.3.1.4.1;pro;Having life come to Earth from outer space would require many additional theoretical requirements, yet it doesn't solve any gaps in our current understanding of life on Earth.;['0', '0', '0', '0', '0']; ;4
69;1.3.1.4.2;pro;DNA originated from RNA, which has also functions other than coding. This would imply that the main process of life (reproduction) hasn't been subjected to any sudden shifts (like interstellar journey). It's been rather a continuous, unbroken slow process of matter organising.;['0', '0', '0', '0', '0']; 2;4
70;1.3.1.6;con;The trip through space would subject any microorganisms to intense amounts of radiation from stars.;['2', '4', '15', '8', '1']; ;3
71;1.3.1.6.1;con;Life that evolved in the presence of high radiation levels would have evolved inherent resistance to it.;['0', '0', '0', '1', '0']; ;4
72;1.3.1.7;con;As we don't know the exact initial circumstances of the creation of life, claiming it started somewhere else just pushes the need for evidence into a philosophical realm or worse a belief system.;['4', '0', '0', '1', '0']; ;3
73;1.3.1.7.1;con;A discussion about how life on earth began is inseparable from one about life in the universe, if the Panspermia Theory is correct, and so it should be explored nonetheless.;['0', '0', '0', '0', '0']; ;4
74;1.3.2;pro;Considering the time dimension of roughly 13.7 billion years for the universe, it is probable that extraterrestrial life exists.;['0', '0', '1', '0', '3']; 7;2
75;1.3.2.1;pro;When viewed through the lens of geological time or deep time, even a fantastically improbable event becomes a near certainty.;['0', '0', '0', '0', '0']; ;3
76;1.3.2.1.1;con;The question of whether the universe is finite or infinite is a matter of ongoing scientific debate without a final answer.;['0', '0', '0', '0', '0']; ;4
77;1.3.2.1.1.1;pro;The Baysian indicator that the universe is infinite assuming the prior probability of an infinite universe is at least as high as the prior probability of a finite universe.;['0', '0', '0', '0', '0']; ;5
78;1.3.2.1.1.2;con;"A finite universe would imply that the space-time has curvature over long distances. No such curvature has ever been observed despite large amounts of data; our universe is flat (Fermi Lab)";['0', '0', '0', '0', '0']; 2;5
79;1.3.2.2;con;Primitive life only began on earth 3.5 billion years ago. This shows that life can take a long time to develop and so life still may not have developed elsewhere.;['0', '0', '0', '0', '0']; ;3
80;1.3.3;pro;Using the Drake Equation, astrobiologists calculated that there are too many planets that could support life for there to have never been alien life.;['0', '0', '0', '0', '6']; 14;2
81;1.3.3.1;pro;The Drake Equation shows that even the most conservative estimates allow for a number of intelligent civilisations in our galaxy alone.;['0', '0', '2', '0', '3']; 3;3
82;1.3.3.1.1;con;Given the speculative nature of the thought experiment, there is no way to establish reasonable conservative estimates, which makes it easier to manipulate the outcome.;['0', '0', '0', '0', '0']; ;4
83;1.3.3.2;pro;Earth is a planet that supports life. There is evidence that other planets are similar to Earth, suggesting that there could be life of any number of planets that are similar to Earth.;['0', '0', '0', '0', '0']; 20;3
84;1.3.3.2.1;pro;Various observed planets are theoretically able to support life.;['0', '0', '0', '0', '0']; ;4
85;1.3.3.2.1.1;pro;There are a total of 60 known planetary bodies which could be potentially habitable.;['0', '0', '0', '0', '1']; 6;5
86;1.3.3.2.1.1.1;pro;Besides Earth, Saturn's largest moon Titan is the only body in the solar system with lakes on its surface. Although these lakes are made of liquid methane and not water, life could be possible.;['0', '0', '0', '0', '0']; 2;6
87;1.3.3.2.1.1.2;pro;Enceladus has warm water geysers that point to a possible life supporting environment.;['0', '0', '0', '0', '0']; ;6
88;1.3.3.2.1.1.2.1;pro;A different team of researchers confirmed the existence of water by giving additional evidence of the presence of hydrothermal vents.;['0', '0', '0', '2', '0']; ;7
89;1.3.3.2.1.1.3;pro;Callisto has subsurface oceans that probably could support life.;['0', '0', '0', '0', '0']; ;6
90;1.3.3.2.1.1.4;pro;Europa has an abundance of liquid water in under-ice oceans that are likely candidates for hosting life.;['0', '0', '0', '0', '0']; ;6
91;1.3.3.2.1.1.4.1;pro;If liquid water exists elsewhere, then there is an increased probability that life exists elsewhere, and as the universe is billions of light years across, one would think this is quite likely.;['0', '0', '0', '0', '0']; ;7
92;1.3.3.2.1.1.4.2;pro;Sulphur traces on Jupiter’s moon Europa may be the waste products of underground bacterial colonies (2003).;['0', '0', '0', '0', '0']; 1;7
93;1.3.3.2.1.2;pro;NASA announced the discovery of phosphine in Venus's atmosphere, a type of chemical that can only be created by a living source.;['0', '0', '0', '0', '0']; 6;5
94;1.3.3.2.1.2.1;con;Late Oct. 2020 analysis indicates that the previously reported Venus phosphine detection-line may be an artefact.;['0', '0', '0', '0', '0']; 1;6
95;1.3.3.2.1.3;pro;Other planets exist in the Goldilocks zone, where a planet is neither too far nor too close to its star for liquid water to be present.;['0', '0', '0', '0', '1']; 2;5
96;1.3.3.2.1.3.1;pro;"Among the more than 4,000 known exoplanets, KOI-456.04 is something special: less than twice the size of Earth, it orbits a sun-like star. And it does so with a ""star-planet distance"" that permits planetary surface temperatures conducive to life.";['0', '0', '0', '0', '0']; 3;6
97;1.3.3.2.1.3.2;pro;"NASA’s Hubble has found water vapor on an ""super-Earth"" exoplanet located in a star's habitable-zone 110 light-years away.";['0', '0', '0', '0', '0']; ;6
98;1.3.3.2.1.4;pro;Evidence suggests that it is possible that there is or at least was life on Mars.;['0', '0', '0', '0', '0']; ;5
99;1.3.3.2.1.4.1;pro;Scientists found indirect, but strong evidence of past life on Mars in a meteorite that fell to Earth.;['0', '0', '0', '0', '0']; 3;6
100;1.3.3.2.1.4.1.1;pro;The meteorite from Mars was composed of minerals and carbon compounds usually created by microbes on Earth. Chains of globules, which are known to be formed by bacteria on Earth, were found under an electron microscope.;['0', '0', '0', '0', '0']; 9;7
101;1.3.3.2.1.4.1.1.1;con;Some blobs, crystals or chemical oddities are not necessarily a sign of life.;['0', '0', '0', '0', '0']; ;8
102;1.3.3.2.1.4.1.2;pro;The meteorite had crystals of magnetic iron oxide, called magnetite, which some bacteria produce.;['0', '0', '0', '0', '0']; ;7
103;1.3.3.2.1.4.1.3;con;Over the past nine years, scientists have scrutinized the Martian meteorite, and now only a few believe that it harboured Martian microbes.;['0', '0', '0', '0', '1']; ;7
104;1.3.3.2.1.4.2;pro;Curiosity rover sediment sampling suggests that microorganisms are close to being discovered on Mars.;['0', '0', '0', '0', '0']; 5;6
105;1.3.3.2.1.4.3;pro;Mars most probably once had habitable atmosphere and still has liquid water reservoirs.;['0', '0', '0', '0', '0']; ;6
106;1.3.3.2.1.4.3.1;pro;Scientists found that water had existed on Mars for 200 million years longer than previously thought, so there was more than enough time for the development of life.;['0', '0', '0', '0', '0']; ;7
107;1.3.3.2.1.4.3.2;pro;In 2015, a team of scientists estimated that about 4.5 billion years ago at least one-fifth of Mars was covered in an ocean more than 450 feet deep. Such a water formation makes it highly possible that forms of life existed and are now hidden in the Martian soil.;['0', '1', '7', '10', '1']; 1;7
108;1.3.3.2.1.4.3.3;pro;Recent scientific evidence suggests that there is a permanently existing body of liquid water on Mars under the planet's south polar ice cap.;['0', '0', '0', '0', '0']; ;7
109;1.3.3.2.1.4.4;con;The search for evidence of past or present life on Mars is ongoing. Possible evidence has been suggested, but there is no consensus in the scientific community that evidence has been found for the existence of past or present life on Mars.;['0', '0', '0', '0', '0']; ;6
110;1.3.3.2.1.5;con;Whilst various conditions could support life as we know it, it is not clear that they can support the creation of life overall. This is because we do not yet fully understand how life comes to be.;['0', '0', '0', '0', '1']; ;5
111;1.3.3.2.1.6;con;Some scientists believe that plate tectonics are necessary for resource distribution that could sustain life. This adds a complicating factor that would limit the number of suitable life sustaining planets.;['0', '0', '1', '0', '1']; ;5
112;1.3.3.2.1.7;con;A planet or celestial body being theoretically able to support life isn’t evidence that there is or was life on it.;['0', '1', '0', '0', '0']; ;5
113;1.3.3.2.1.7.1;pro;The probability of alien life is not just a function of the number of planets, but also of the probability of life developing on those planets. Although we know that the first number is colossal, the second number may be so small that the existence of aliens becomes very unlikely.;['0', '0', '0', '0', '0']; 4;6
114;1.3.3.2.1.7.2;pro;The presence of conditions that are necessary for life does not equal the presence of conditions that are sufficient for life - or the presence of life itself.;['0', '0', '0', '0', '0']; ;6
115;1.3.3.2.1.7.2.1;pro;There are satelites inside our own solar system with presence of organic compounds galore but no sings of life whatsoever.;['0', '0', '0', '0', '0']; ;7
116;1.3.3.2.2;pro;The universe is statistical and macroscopically homogeneous. This means identical probabilities lie across the whole area. If life came to be possible on Earth, the same possibility exists elsewhere.;['0', '0', '0', '0', '0']; 12;4
117;1.3.3.2.2.1;pro;Based on the assumption that only 1% of Earth-like planets develop life, and that on 1% of those planets, the life advances to an intelligent level (like it did here on Earth). That would mean there were 10 quadrillion (10 million billion) intelligent civilizations in the observable universe.;['0', '0', '0', '0', '0']; 3;5
118;1.3.3.2.2.1.1;pro;Based on the most conservative estimates of 5% (some go up to 20%) and the lower end of the total number of stars (10^22), there are 500 quintillion (500 billion billion) sun-like stars.;['0', '0', '0', '0', '0']; ;6
119;1.3.3.2.2.1.1.1;pro;A study found that 22% of Sun-like stars harbor Earth-size planets orbiting in their habitable zones.;['0', '0', '0', '0', '0']; ;7
120;1.3.3.2.2.1.2;con;While 1% of Earth-like planets may seem like a conservative estimate, there is no reason to assume or expect that planets with similar conditions to Earth would develop intelligent life at all.;['0', '0', '0', '0', '0']; ;6
121;1.3.3.2.2.2;con;How life was kick-started on Earth has still not been completely discovered. Unless we know this, we cannot make claims as to whether other celestial bodies have conditions that are sufficient for organic life.;['0', '0', '0', '0', '0']; 9;5
122;1.3.3.2.2.2.1;pro;It is necessary to know all the steps in a process - and the chances of them happening - in order to determine its chances of occurring. Experiments so far, including Miller's, suggest mechanisms for only one step in an unknown process. A single unknown step with an essentially nil chance of occurring relative to the size of the universe would change the conclusion.;['0', '0', '0', '0', '0']; 4;6
123;1.3.3.2.2.2.1.1;pro;No mechanisms or experiments have yet demonstrated the abiotic generation of polypeptides or polysaccharides.;['0', '0', '0', '0', '0']; 4;7
124;1.3.3.2.2.2.2;con;Since the Miller-Urey experiment in 1952, there has been a good baseline understanding of the general process of how life was kickstarted on Earth.;['0', '2', '4', '6', '4']; 6;6
125;1.3.3.2.3;pro;Our existence can be used to measure the probability of existence of life outside our solar system.;['0', '0', '0', '0', '0']; 8;4
126;1.3.3.2.4;con;According to NASA, the Earth is the only planet in our solar system that is mostly covered in water. This is essential for supporting life.;['0', '0', '0', '0', '0']; 8;4
127;1.3.3.2.5;con;In the context of the wider universe, the Milky Way and Earth might be unusually well-suited to support organic life, for example in terms of the solar system's metallicity.;['0', '0', '0', '0', '0']; 14;4
128;1.3.3.2.5.1;pro;The Earth is an electromagnet which gives it a field that protects life from harmful radiation. This may be an important factor in sustaining life.;['0', '0', '0', '0', '1']; ;5
129;1.3.3.2.5.1.1;pro;Radiation may decrease the viability of life, such that major solar events are also a contributing factor in the formation of life.;['0', '0', '0', '0', '0']; ;6
130;1.3.3.2.5.1.2;con;Some believe that life can be sustained from radiation.;['0', '0', '0', '0', '0']; ;6
131;1.3.3.2.5.2;con;As known life is a product of the Earth's location, and constitution, differently located and constituted planets might be able to create different forms of life.;['0', '1', '8', '4', '1']; ;5
