;Level;Stance;Claim;Votes;Comments;Depth
260;1.5.8.6;con;In most cases the argument against the existence of aliens is actually just an acceptance that convincing evidence for their existence is lacking. Thus, no definite argument from ignorance is made.;['0', '0', '0', '0', '0']; ;3
261;1.5.8.7;con;Although the lack of evidence is not decisive, it is justifiable to refuse to agree to a proposition until some evidence or support is provided.;['1', '0', '2', '3', '3']; ;3
262;1.5.8.7.1;pro;Scientific conclusions should be evaluated in terms of their burden of proof. Grandiose claims, like the existence of extraterrestrial life, require more evidence to support.;['0', '0', '0', '0', '0']; 3;4
263;1.6;con;There has not yet been any form of contact with extraterrestrial beings.;['0', '0', '0', '0', '0']; 15;1
264;1.6.1;pro;We have been listening for radio signals from other solar systems since 1960, and have never heard anything.;['0', '0', '2', '2', '2']; 3;2
265;1.6.1.1;con;Fast radio bursts (FRBs) are mysterious pulses that emit more energy in a short time than the Sun does in 24 hours. Experts have theorized that they are produced by a far ultra-advanced civilization, trying to speak to us through signals we can barely comprehend.;['0', '0', '0', '1', '0']; 1;3
266;1.6.1.1.1;con;The source of fast radio bursts (FRB) is unknown but natural cause proposals include: magnetars, black hole and neutron star collisions, a gamma-ray burst connection, especially energetic supernovae, and dark matter-induced collapse of pulsars.;['0', '0', '0', '0', '0']; 1;4
267;1.6.1.2;con;"According to the ""Zoo hypothesis"", aliens may be purposely preventing us from contacting them, so that they do not interrupt humans' natural development. In short, Earth might be kind of a ""zoo"" for aliens, to watch our growth as a species.";['1', '12', '4', '2', '3']; 2;3
268;1.6.1.2.1;con;In order for the Zoo Hypothesis to be true, it would be necessary that the universe be dominated by a single highly developed civilization - such that it could force all other civilizations to stick to its rules.;['1', '3', '3', '9', '2']; 7;4
269;1.6.1.2.1.1;con;It is not clear what use humanity would have to any alien civilisation, therefore it does not follow that one society would have to dominate to keep us in a zoo.;['0', '0', '0', '0', '0']; ;5
270;1.6.1.3;con;Communication can be extremely difficult or even impossible for various reasons.;['0', '0', '0', '1', '0']; 2;3
271;1.6.1.3.1;pro;According to the Rare Earth Hypothesis, Earth's circumstances are so rare it is conceivable that alien civilizations will be far away. This makes it very difficult to communicate or meet them even if they exist.;['0', '0', '0', '0', '1']; 9;4
272;1.6.1.3.1.1;pro;The distances in space might be too vast for contact. The furthest known galaxy is 32 billion light years away from Earth, and even the outer edge of our galaxy is 100.000 light years away. As no message can travel faster than the speed of light, this makes communication next to impossible.;['0', '0', '0', '0', '0']; ;5
273;1.6.1.3.1.1.1;pro;The light that could tell an observer that life exists on Earth - which happened around 15.000 years ago - has not yet reached any observer further away than 15.000 light years. It has thus made it only 15% of the way through the Milky Way and only 0.00005% of the way to the most distant galaxy we know of.;['0', '1', '2', '10', '4']; ;6
274;1.6.1.3.1.2;con;The Rare Earth hypothesis assumes that galactic regions that are suitable for life are rare. By this logic, there is no reason why other life-supporting planets might not actually be very close. After all, our galactic region is apparently suitable for them.;['1', '7', '5', '3', '0']; 6;5
275;1.6.1.3.1.2.1;pro;True random distribution will result in some clusters close together.;['0', '0', '0', '0', '0']; ;6
276;1.6.1.3.1.2.1.1;con;That does not mean that we are in such a cluster.;['1', '2', '5', '5', '2']; ;7
277;1.6.1.3.1.2.1.2;con;In the context of the universe's vastness, even clusters might be characterized by distances between their individual elements that make communication next to impossible.;['0', '0', '1', '4', '0']; ;7
278;1.6.1.3.2;pro;Based on the Great Filter theory, alien life could exist, but is incapable of technologically advancing enough for long-distance space communication or travel for various reasons.;['0', '3', '6', '8', '2']; 19;4
279;1.6.1.3.2.1;pro;The mother planets' resources could have been exploited and consumed before the civilizations were able to leave them.;['1', '5', '8', '4', '0']; ;5
280;1.6.1.3.2.2;pro;Physical space travel and colonisation could generally be too expensive or inefficient.;['0', '2', '6', '9', '1']; ;5
281;1.6.1.3.2.3;pro;Some sort of (global) catastrophe could prevent intelligent life from reaching a certain level of technology.;['0', '3', '9', '6', '0']; ;5
282;1.6.1.3.2.4;con;If Great Filter theory is true, then it is unlikely that humans will ever encounter intelligent extraterrestrial life, making the existence of such life trivial.;['0', '0', '0', '0', '0']; 1;5
283;1.6.1.3.3;pro;The time it takes for radio signals to broadcast throughout the universe is much larger than the time we have spent listening for responses.;['0', '0', '0', '0', '0']; ;4
284;1.6.1.3.3.1;pro;Earth's (broadcast) signals have reached every star within about 80 light years (as of 2016) from the sun – about 8,531 stars and 3,555 Earth-like planets. That is a very tiny fraction of what is out there. Furthermore, it would take the same amount of time for aliens to answer.;['0', '0', '0', '0', '0']; ;5
285;1.6.1.3.3.2;con;This misunderstands what we are listening for. If an alien civilisation is persistently using radio waves to communicate, once they have started reaching us, they'll continue to do so for whatever period of time that civilisation used them.;['1', '1', '0', '2', '3']; 3;5
286;1.6.1.3.3.2.1;pro;Alien civilizations might have died long ago and any radiowaves they used might have long passed by Earth.;['0', '0', '0', '0', '0']; ;6
287;1.6.1.3.3.2.1.1;pro;Assuming for the sake of argument that there was earlier intelligent life on earth, unless it were incredibly long lived, the traces left by it would likely not be sufficient to distinguish it from other geological events.;['0', '0', '0', '0', '0']; ;7
288;1.6.2;con;It is possible that communication with extraterrestrial beings may have been established, but this information was withheld from the public.;['0', '0', '0', '1', '1']; ;2
289;1.6.2.1;pro;Some people suspect that NASA may be hiding evidence of UFOs.;['0', '1', '0', '0', '1']; ;3
290;1.6.2.1.1;con;It is unclear that NASA's incentives would align with such behaviour, as the existence of aliens would likely lead to an increase in their funding.;['0', '0', '0', '0', '0']; ;4
291;1.6.2.2;pro;Some believe that the 'Oumuamua is an example of outreach from aliens.;['1', '0', '1', '0', '0']; 3;3
292;1.6.2.2.1;pro;Avi Leob, a prominent theoretical physicist, believes ‘Oumuamua is an alien object.;['0', '0', '1', '0', '0']; 1;4
293;1.6.2.3;pro;It is in the best interest of major world governments to maintain peaceful social order, and information about extraterrestrial life could create social disorder.;['0', '0', '1', '0', '1']; 49;3
294;1.6.2.3.1;pro;Conspiracies surrounding alien existence have existed for years. If these were legitimised, it may exacerbate other forms of conspiratorial thinking, and decrease trust in governments.;['0', '0', '0', '0', '0']; ;4
295;1.6.2.3.2;con;People generally indicate that they would react positively if alien life was discovered.;['0', '0', '0', '0', '0']; ;4
296;1.6.2.3.2.1;con;It appears that this positive reaction was solicited through reference to discoveries of extraterrestrial microbial life, not what we would traditionally conceptualise as alien life.;['0', '0', '0', '0', '0']; ;5
297;1.6.2.4;con;Without evidence of a coverup, well documented unexplained phenomena, or other reasons to suspect a global conspiracy, it is dubious to assert that one exists.;['0', '0', '0', '0', '2']; 8;3
298;1.6.3;con;It is possible that extraterrestrial life would intentionally avoid making contact with humans, some of which have been discussed through science fiction.;['0', '4', '7', '5', '3']; 12;2
299;1.6.3.1;pro;"Aliens might just not recognize us as a species worth getting in touch with, similar to the story line of Orson Scott Card's ""Ender's Game"". In the book, the so-called Formics are so different from humans that they do not recognize us as a sentient life form and without bother kill hundreds of millions.";['1', '3', '10', '4', '3']; 1;3
300;1.6.3.1.1;pro;Alien civilization could be millions of years ahead of mankind and look at us like we do at ants.;['0', '5', '6', '3', '3']; ;4
301;1.6.3.1.1.1;pro;"Earth is estimated to be about 4.5 billion years old; the universe is estimated to be about 13.8 billion years old. This difference leaves plenty of room for other species to get a head start compared to humans.";['0', '4', '4', '8', '1']; ;5
302;1.6.3.1.1.2;con;Even if we are like ants to aliens, it is possible to live symbiotically as is explored in Sue Burke's 'Semiosis'. The world explores how even with very different forms of consciousness, humans and alien lifeforms can eventually co-operate.;['0', '0', '0', '0', '0']; ;5
303;1.6.3.1.1.2.1;pro;Humans domesticated dogs, there is no reason a suitably advanced alien species would not try domesticate us if we were useful to them.;['0', '0', '0', '0', '0']; 1;6
304;1.6.3.3;pro;According to the mediocrity principle, which can be interpreted as suggesting that there is nothing extraordinary about humanity in a universe that likely contains other species, there is no special reason for aliens to contact the inhabitants of Earth.;['0', '4', '7', '2', '1']; 12;3
305;1.6.3.4;pro;"Aliens might refrain from contacting us as they are cautious. As the SciFi literature has it, even a vastly superior species might fall prey to unexpected problems, just as the martians in H. G. Well's ""The War of the Worlds"" unexpectedly die from microbial infections to which they have no immunity.";['0', '4', '9', '5', '2']; 1;3
306;1.6.3.4.1;pro;Aliens might be outright scared - Earth or its inhabitants may seem threatening to them.;['0', '0', '0', '0', '0']; 12;4
307;1.6.3.4.1.1;pro;Similar to how Stephen Hawking argues that we should stay silent and try to avoid contact with alien species, so might aliens stay quiet out of caution and fear.;['1', '3', '3', '9', '0']; ;5
308;1.6.3.4.2;pro;The process of contacting other species itself might be dangerous, since it may reveal information to more advanced and possibly dangerous third parties.;['0', '0', '0', '0', '0']; 1;4
309;1.6.3.4.3;con;If intelligent life were common, by a law of averages some would be cautious, while others wouldn't be. We'd expect to hear from the second set.;['0', '0', '0', '0', '0']; ;4
310;1.6.3.5;con;Aliens that have developed radio communication would likely broadcast their presence whether they want to or not.;['1', '0', '0', '0', '1']; ;3
311;1.6.3.5.1;con;If we are not looking in the right places, then we would not have noticed their radio activity yet.;['0', '0', '1', '0', '0']; ;4
312;1.6.3.6;con;Intelligence and curiosity are characteristics linked on a neuronal level. Were aliens intelligent enough to contact others then, like humans, they would likely do so.;['0', '0', '1', '0', '0']; 14;3
313;1.6.3.6.1;pro;Technological progress requires a constant gain of information and knowledge. Curiosity is the key factor that provokes this process. If aliens discovered and use technology, it is very likely curiosity is an attribute of their character as well.;['0', '1', '4', '9', '0']; ;4
314;1.6.3.6.2;con;Human beings evolved as curious creatures due to our particular environmental conditions, which reward curiousity and exploration. It is entirely plausible that life evolving elsewhere in the universe would encounter inverse conditions, that select against such a trait.;['0', '3', '8', '3', '0']; ;4
315;1.6.3.6.3;con;The behaviour of a significantly more intelligent being is completely unknown and unguessable to humans. We have not enough data to extrapolate.;['0', '6', '4', '7', '1']; ;4
316;1.6.3.6.4;con;There is absolutely no proof that alien civilizations are comparable to humans in terms of intelligence and curiosity.;['0', '4', '8', '6', '0']; ;4
