;Level;Stance;Claim;Votes;Comments;Depth
132;1.3.3.2.5.2.1;pro;The same physics in a different environment could well yield unknown biochemistry.;['0', '0', '0', '0', '0']; ;6
133;1.3.3.2.5.2.1.1;pro;Earth's biochemistry is based on the available raw material and energy.;['0', '0', '0', '0', '0']; ;7
134;1.3.3.2.5.3;con;In the Milky Way galaxy, there are about 75 billion red dwarf stars. Six percent of these red dwarf stars have an Earth-sized planet in the habitable zone, which is warm enough for crucial life sustaining liquid water on the planet’s surface.;['0', '0', '0', '0', '0']; 4;5
135;1.3.3.2.5.3.1;pro;Even the next star to our solar system, the red dwarf star Proxima Centauri, has an Earth-sized planet in its habitable zone, which could theoretically support liquid water.;['0', '3', '6', '9', '3']; ;6
136;1.3.3.2.5.3.2;con;Young red dwarf stars have high flare emitting activity, which can sterilize and damage the atmospheres of surrounding planets.;['0', '3', '13', '3', '1']; ;6
137;1.3.3.3;con;The Drake Equation presumes an unproven model of the origin of the Cosmos - the Big Bang.;['0', '0', '0', '0', '0']; ;3
138;1.3.3.3.1;con;Evidence indicates that the Big Bang hypothesis is correct.;['0', '0', '0', '0', '1']; ;4
139;1.3.3.4;con;The Drake Equation was not written for quantification, but for stimulating a debate. Thus it does not calculate anything, but proposes that there could be a possibility that alien civilisations exist.;['1', '3', '9', '14', '3']; ;3
140;1.3.3.4.1;pro;Even as a philosophical question, the Drake Equation is a distraction from legitimate quantitative analysis beyond the parameters of the equation.;['0', '0', '0', '0', '0']; ;4
141;1.3.3.4.2;con;A debate can still be useful for exploring what is possible. The lack of adequate examination should not be taken as proof that something does not exist.;['0', '0', '0', '0', '0']; ;4
142;1.3.3.4.2.1;con;In the case of the Drake Equation, it is especially important to avoid speculation because of the unverifiable unknowns.;['0', '0', '0', '0', '0']; ;5
143;1.3.3.4.2.1.1;pro;Specifically, values IV and V of the equation - the fraction of life-sustaining planets that develop life, and the fraction of life-developing planets that develop to sentience - are values we have no good way to estimate.;['0', '0', '0', '0', '0']; ;6
144;1.3.4;con;This argument is based on an appeal to probability, which is a logical fallacy. Just because something could happen does not mean it is certain to.;['2', '1', '1', '0', '1']; 7;2
145;1.3.4.1;con;It doesn't fall under the appeal to probability as the argument did not say anything about something certainly happening, for it merely implied that it would be probable.;['0', '0', '0', '0', '0']; 2;3
146;1.3.5;con;According to the Fermi Paradox, there is a contradiction between the lack of evidence and high probability estimates.;['1', '2', '1', '0', '1']; 1;2
147;1.3.5.1;pro;"The Fermi Paradox is explainable by ""The Rare Earth Hypothesis"": if life were probable, we'd expect to find more evidence. If intelligent life were probable, we'd almost certainly have already been visited by aliens.";['0', '1', '0', '0', '1']; 5;3
148;1.3.5.3;con;The Fermi-Paradox accepts that large barriers or filters could be responsible for the extinction of ancient alien life forms with high intellect. However, it does allow for both former highly intelligent aliens and low intellect forms of life that may be present.;['0', '0', '1', '0', '4']; ;3
149;1.3.5.3.1;pro;It is very likely that extraterrestrial life consists of non-rational viruses, bacteria or algae, making it difficult to discover.;['0', '0', '0', '0', '0']; ;4
150;1.3.5.3.1.1;pro;Based on the fact that viruses (or virions - viruses outside of hosts) can be found everywhere on Earth in enormously high amounts - the oceans alone contain an estimated 10^31 individual virions. We can infer that the most likely alien lifeforms are viruses.;['0', '0', '1', '0', '0']; ;5
151;1.3.5.3.1.1.1;pro;The necessary technology for detecting virions, e.g., on rocks is still in development. Therefore, next to no research could be done on alien viruses or virions yet.;['0', '0', '1', '0', '0']; ;6
152;1.3.5.3.1.1.2;con;"There is no scientific consensus if viruses are ""alive"" or not.";['0', '0', '2', '0', '1']; ;6
153;1.3.5.3.1.1.2.1;con;Recent evidence suggest that viruses are lifeforms, as they share unique properties with cells and evolved as separate entities.;['0', '0', '0', '0', '0']; ;7
154;1.3.5.3.1.2;pro;Simple, single-celled life exists almost everywhere on Earth.;['0', '0', '0', '0', '0']; ;5
155;1.4;con;The creation of life by chance may well be such a fantastically improbable event that it has happened only once.;['23', '12', '8', '4', '12']; 5;1
156;1.4.1;pro;There is no evidence of life emerging independently on Earth more than once (i.e. all known life shared a common ancestor, LUCA). This is evidence of improbability of the emergence of life.;['1', '3', '0', '4', '0']; ;2
157;1.4.1.1;con;Some scientists believe that octopuses may have extra-terrestrial origins.;['0', '0', '0', '0', '0']; 5;3
158;1.4.1.2;con;It might be improbable to happen twice on the scale of a planet, but on the scale of the countless planets in the vast universe, it might be a regular occurrence.;['0', '0', '0', '0', '2']; ;3
159;1.4.2;pro;There could be different laws of physics throughout the universe that prevent life from emerging elsewhere.;['2', '3', '2', '0', '0']; 10;2
160;1.4.2.1;pro;Different laws of physics could affect the evolution of life as well as eliminate it.;['0', '0', '0', '0', '0']; 4;3
161;1.4.2.1.1;pro;Given that gravity plays a role in evolution, different amounts of gravity could impeded the development of life.;['0', '0', '0', '0', '0']; ;4
162;1.4.2.1.2;pro;Different laws of physics may affect how stars burn, reducing the availability of heavy elements necessary for the formation of life.;['0', '0', '0', '0', '0']; ;4
163;1.4.2.1.3;pro;Life as we know it has evolved on a planet with almost perfect conditions, so it might take a longer time for life to evolve on “imperfect” planets.;['0', '0', '0', '0', '0']; 6;4
164;1.4.2.1.4;con;Since evolution is all about adaption, life in other regions might have been able to adapt to different laws of physics.;['0', '0', '0', '0', '0']; ;4
165;1.4.2.2;pro;Since the laws of physics of today have developed over time after the Big Bang, we can assume that they need particular circumstances to emerge. This suggests that parts of the universe might have created different laws of physics.;['0', '0', '0', '0', '0']; ;3
166;1.4.2.2.1;pro;One of the fundamental constants of physics - the strength of electromagnetism - does not appear to be constant throughout the universe.;['0', '0', '0', '0', '0']; ;4
167;1.4.2.3;con;Even if there are many different laws throughout the universe, that does not mean they will all preclude life from emerging, rather that life may just take different forms.;['0', '0', '0', '0', '0']; 1;3
168;1.4.2.4;con;The differences in Planck's constant, a fundamental constant in physics, across locations is minimal.;['0', '0', '0', '0', '0']; ;3
169;1.4.3;con;Scientific findings suggest that the creation of life is not improbable.;['1', '0', '2', '2', '4']; ;2
170;1.4.3.1;pro;A recent experiment recreated early atmospheric conditions on Earth and found out that RNA molecules (building blocks for DNA) were present after just a few days. This suggests that it is likely life could exist elsewhere.;['0', '0', '0', '0', '0']; 1;3
171;1.4.3.2;con;Living things are complex. In order to form a living reproductive cell, it is necessary to have both the appropriate materials and fitting stable conditions.;['0', '0', '0', '0', '0']; 14;3
172;1.4.3.2.1;pro;There are so many variables that have to be perfect for a planet to hold life. e.g. presence of water, correct temperature, correct size to hold an atmosphere, right distance from a star, right place in a galaxy.;['0', '0', '0', '0', '0']; 2;4
173;1.4.3.2.1.1;pro;These necessary variables of planetary habitability makes life on Earth (or other planets) incredibly improbable, especially as the universe is constantly increasing in entropy (meaning the longer time goes on, the more unlikely it is that these conditions exist).;['0', '0', '0', '0', '0']; 5;5
174;1.4.3.2.1.1.1;con;Biological life on Earth arose from the same physical and elemental bounds observed on other planets.;['0', '0', '0', '0', '0']; ;6
175;1.4.3.2.1.1.2;con;Given the theory of evolution, it stands to reason that the only life we might find in a particular environment would be life that is compatible with that environment. Life may take other forms in places that are not Earth.;['0', '0', '0', '0', '0']; ;6
176;1.4.5;con;The elements which make up life - such as carbon, nitrogen, oxygen, hydrogen, phosphorous, sodium, magnesium, potassium - are the most common in the universe.;['0', '1', '0', '1', '4']; 3;2
177;1.4.5.1;pro;Water is comprised of hydrogen and oxygen, which are the 1st and 3rd most abundant elements in the universe. From a statistical standpoint, water is more likely to exist than any other solvent, and therefore has the highest probability of being the solvent used by a lifeform.;['0', '0', '0', '0', '0']; 5;3
178;1.4.5.2;pro;That carbon, the key element in carbon-based lifeforms, is very stable and sufficiently abundant in the universe suggests that carbon-based life is highly probable under approximately Earth-like conditions.;['0', '0', '0', '0', '0']; ;3
179;1.4.5.3;con;The abundance of constituent elements necessary for life (as we know) is not sufficient proof that the organisation of these elements to manifest itself as life is common.;['0', '0', '0', '0', '0']; ;3
180;1.5;con;The galaxy is so old that other technological species living in it before us should be obvious by now (Dyson spheres, Von Neumann probes, colonization) yet we have no evidence of it.;['0', '0', '0', '0', '0']; 3;1
181;1.5.1;pro;After analyzing thousands of galaxies with NASA’s Wide-field Infrared Survey Explorer (WISE) space telescope, Penn State researchers could not find any evidence of alien civilizations on the basis of the emitted heat a highly developed civilization's energy supply would cause.;['1', '0', '0', '1', '0']; 4;2
182;1.5.1.1;con;The further away we look, the deeper into the past we are seeing, therefore not finding something means that it wasn't in existence at that stage. If intelligent civilizations had formed more recently, information about their existence won't reach us for millions of years.;['0', '0', '1', '0', '0']; 9;3
183;1.5.1.3;con;It's likely that an advanced civilisation would have highly efficient technology that would not lead to massive amounts of waste heat.;['1', '1', '2', '1', '2']; 1;3
184;1.5.1.4;con;The WISE search looked for extremely-advanced Type III civilizations. Being unable to find any does not rule out the existence of Type II, or lower, civilizations. For example, Humanity is a Type 0.;['0', '0', '2', '0', '3']; ;3
185;1.5.2;pro;It is unlikely that aliens exist in the galaxy because there is an absence of change in asteroids or planetary resources that would be expected if intelligent life existed.;['0', '0', '0', '0', '1']; 6;2
186;1.5.2.1;pro;There is no reason to assume that aliens would attempt to conceal their existence (p. 278).;['0', '0', '0', '0', '0']; ;3
187;1.5.2.2;con;Single celled organisms would likely be quite boring for complex life forms capable of intergalactic travel. If aliens had encountered Earth at this stage, they may have left to explore more interesting areas of the universe.;['0', '0', '0', '0', '0']; ;3
188;1.5.3;pro;Humans have been searching for extraterrestrials since as early as 1896 and yet we still have no definite proof they exist.;['0', '0', '0', '0', '0']; 15;2
189;1.5.3.1;pro;Large numbers of researchers and astronomers study the night sky on a daily basis, yet have discovered no signs of alien life.;['0', '0', '0', '0', '0']; 3;3
190;1.5.3.1.1;con;There have been many sighting of unidentified objects, with many flying in ways that no known human craft could.;['0', '0', '0', '0', '0']; 5;4
191;1.5.3.1.1.1;pro;The Rendlesham Forest incident may have been a sighting of an alien spacecraft.;['0', '0', '0', '0', '0']; ;5
192;1.5.3.1.1.1.1;con;There are plausible explanations for the event that do not involve any aliens.;['0', '0', '0', '0', '0']; ;6
193;1.5.3.1.1.1.1.1;pro;The nearby Orfordness Lighthouse could have beamed light into the forest.;['0', '0', '0', '0', '0']; ;7
194;1.5.3.1.1.1.1.2;pro;U.S. security policeman, Kevin Conde, might have caused the incident by driving around the forest in a police vehicle with modified lights.;['0', '0', '0', '0', '0']; 2;7
195;1.5.3.1.1.1.1.3;pro;"The Rendlesham Forest incident may have been caused by the SAS as an act of revenge against the USAF, which previously interrogated and beaten up SAS troops and labelled them as ""unidentified aliens"".";['0', '0', '0', '0', '0']; ;7
196;1.5.3.1.1.2;pro;The Phoenix Lights incident may have been a sighting of an alien spacecraft.;['0', '0', '0', '0', '0']; ;5
197;1.5.3.1.1.2.1;con;The Phoenix Lights were most likely individual planes that, due to their illusory contour, could have looked like a single shape to the human eye.;['0', '0', '0', '0', '0']; ;6
198;1.5.3.1.1.2.2;con;The official explanation of the Phoenix Lights was that they were military flares.;['0', '0', '0', '0', '0']; ;6
199;1.5.3.1.1.3;pro;Harvard astrophysicist Avi Loeb has claimed that an interstellar object spotted in 2017 was evidence of an alien civilization.;['0', '0', '0', '0', '0']; ;5
200;1.5.3.1.1.3.1;con;There are alternative explanations for this interstellar object.;['0', '0', '0', '0', '0']; ;6
201;1.5.3.1.1.4;pro;The Belgian UFO Wave may have involved sightings of many alien spacecrafts.;['0', '0', '0', '0', '0']; ;5
202;1.5.3.1.1.4.1;con;"The photo that served as ""evidence"" for the UFO wave is an admitted hoax.";['0', '0', '0', '0', '0']; ;6
203;1.5.3.1.1.5;con;"Mick West (a retired gaming programmer) and others have identified visual artifacts of cameras and other explanations of UFO sightings: low viewing angle, camera out of focus, night vision and triangular aperture artifacts, infrared camera zoom artifact, glare from airliner engines, and an artifact of a camera's de-rotation mechanism which corrects ""gimbal roll"".";['0', '0', '0', '0', '0']; 2;5
204;1.5.3.1.1.6;con;The ping-pong ball movement effect observed in some UFO sightings can be caused by a combination of camera switching modes and performing gimbal rolls, as proposed by Mick West and others.;['0', '0', '0', '0', '0']; 3;5
205;1.5.3.1.1.7;con;Perspective, etc. can cause the drift of a balloon being mistaken for fast airspeed, as proposed by Mick West and others.;['0', '0', '0', '0', '0']; 1;5
206;1.5.3.2;con;It has been argued that Earth-based sightings of evidence for alien species have never been scientifically, methodologically studied beyond anecdotal reports of observations.;['0', '0', '0', '0', '0']; 2;3
207;1.5.3.2.1;pro;In August 1977, a strong pulse of radiation was recorded coming from near the constellation Sagittarius. This was unprecedented, and could evidence extraterrestrial life.;['0', '0', '0', '0', '0']; 1;4
208;1.5.3.2.2;pro;Little serious research regarding the search for aliens has been undertaken, as governmental and scientific authorities observe a de-facto taboo on the subject and its funding.;['0', '2', '6', '7', '2']; 4;4
209;1.5.3.2.2.1;pro;Television shows, like The X-Files and Ancient Aliens, portray extraterrestrial research as fictionalized which undermines its credibility.;['0', '0', '0', '0', '0']; 1;5
210;1.5.3.2.2.2;con;Serious research regarding the search for aliens is unrelated to the pseudoscientific study of UFOs, which mainstream scientists have a justified taboo against.;['0', '0', '0', '0', '1']; ;5
211;1.5.3.2.2.3;con;US intelligence agencies have until mid 2021 to share what they know about UFOs, thanks to the COVID-19 relief and spending bill.;['0', '0', '0', '0', '0']; 6;5
212;1.5.3.3;con;In the context of how old the universe is, less than 200 years is a minuscule amount of time.;['0', '0', '0', '0', '0']; ;3
213;1.5.4;con;Earthlings could be the first to appear long before the universe’s most fertile life-bearing years. Therefore, aliens might not exist yet.;['0', '1', '0', '0', '1']; 5;2
214;1.5.4.1;pro;Radiation in the cosmos has decreased. That has resulted in a universe that is 20 times more liveable today than it was four billion years ago, when life first appeared on Earth.;['2', '1', '7', '12', '3']; ;3
215;1.5.4.1.1;con;"The universe is becoming ""more livable"" over time, and the existence of human beings used as supporting evidence in this claim, actually seems to support the opposite.";['0', '0', '0', '1', '0']; 1;4
216;1.5.4.2;pro;Red dwarf stars can live up to 10 trillion years. Compared to that, the approximate 13.8 billion years of the universe so far is a blink. As the universe is still in its childhood, the emergence of life might take more time outside of Earth.;['1', '5', '6', '12', '1']; 9;3
217;1.5.4.3;pro;Life may be about one thousand times more likely to arise in the distant future considering the probability of habitable, Earth-like planets forming over trillions of years.;['1', '3', '9', '11', '1']; ;3
218;1.5.4.3.1;con;"Event A being ""more likely"" to happen in the future is not proof that event A has not taken place in the past.";['0', '0', '0', '0', '0']; ;4
219;1.5.4.4;con;The probability that humanity was the first technologically-advanced species to be created is less than one in ten billion trillion.;['1', '6', '9', '7', '1']; 8;3
220;1.5.4.5;con;"We might also be cosmological ""late bloomers"". 15 million years after the Big Bang, the cosmic microwave background created mild temperatures which made large parts of the universe habitable and established good conditions for life to develop.";['0', '3', '13', '5', '4']; 12;3
221;1.5.5;con;There is no reason to believe that alien life would develop technology along the path human futurists have predicted.;['0', '0', '1', '0', '3']; ;2
222;1.5.6;con;The technology available today might not be sufficient to detect alien life.;['0', '0', '1', '0', '1']; 3;2
223;1.5.6.1;pro;Historically, scientific breakthroughs and new discoveries were possible due to technologic advancements.;['0', '0', '0', '0', '0']; ;3
224;1.5.6.1.1;pro;Microscopic life could only be discovered with the aid of specialized equipment.;['0', '0', '0', '0', '0']; 7;4
225;1.5.6.1.2;pro;Up to around 100 years ago, we had no evidence for the existence of many sub-atomic particles.;['0', '0', '0', '0', '0']; ;4
226;1.5.6.2;pro;Aliens may be transmitting signals that are not detectable with human senses or technology.;['0', '0', '0', '0', '2']; 2;3
227;1.5.6.2.1;pro;Radio transmission has been used only for 100 years by humankind and may soon by replaced by more advanced technologies. An alien civilisation could similarly have used radio for only or a short time or even never.;['0', '4', '5', '8', '1']; ;4
228;1.5.6.2.1.1;pro;A range of radio frequencies in the Microwave Window are assumed to be highly useful for interstellar communication.;['0', '4', '6', '7', '0']; 3;5
229;1.5.6.2.1.2;con;The use of radio waves has been growing rather than declining because radio waves make it possible to communicate across long distances, including between Earth and devices in space.;['0', '0', '0', '0', '0']; 3;5
230;1.5.6.2.1.2.1;pro;WiFi, Bluetooth, cordless phones, and cell phones all operate on radio waves and are used around the world, which was not the case 50 years ago.;['0', '0', '0', '0', '0']; ;6
231;1.5.6.2.1.2.2;con;Besides radio waves, there are other ways of free-space communication, such as laser (optical) communication.;['0', '0', '0', '0', '0']; ;6
232;1.5.6.2.2;pro;Aliens may be using other means of communicating, which humans are not equipped to detect.;['0', '4', '6', '7', '1']; 10;4
233;1.5.6.2.2.1;pro;There could be alien civilizations that do not transmit strong enough signals to be detected by humans at this stage in our development.;['0', '0', '0', '0', '0']; 5;5
234;1.5.6.2.3;pro;There are limits to human perception.;['0', '0', '0', '0', '0']; 2;4
235;1.5.6.2.3.1;pro;Humans are only capable of interpreting data within the limits of their cognitive capabilities and comprehension.;['0', '0', '0', '0', '0']; 13;5
236;1.5.6.2.3.1.1;pro;"Mysterians believe that there is a limit to human cognition; some thoughts are too complex for our brains. This may hamper our ability to reach out to aliens.";['0', '0', '0', '0', '0']; 4;6
237;1.5.6.2.3.1.2;con;There is no reason to assume that human limits are absolute and that humans are incapable of improving their capabilities and comprehension.;['0', '0', '0', '0', '0']; ;6
238;1.5.6.2.3.2;pro;"Human perception is open to only a tiny share of the whole electromagnetic spectrum; this may inhibit our ability to detect some forms of transmission or signals.";['1', '6', '5', '6', '0']; 2;5
239;1.5.6.2.3.3;con;Humanity has already put various satellites into space that can see beyond the visible spectrum and recognize - for example - radio, micro and X-Ray waves.;['0', '1', '3', '6', '0']; ;5
240;1.5.6.2.4;con;If an alien race were trying to communicate with us, and they had already found a means of communicating at far reaches, it is reasonable to assume that they would be able to reverse engineer our technology in order to speak with us.;['0', '0', '0', '0', '0']; ;4
241;1.5.6.3;con;Technology is expanding constantly, and so too is our ability to detect aliens.;['0', '0', '0', '0', '1']; ;3
242;1.5.7;con;"Alien life could have existed in the past. The fact that humans have not discovered any evidence is irrelevant as they could just have ""missed"" the lifespan of an alien civilization.";['0', '0', '1', '0', '1']; ;2
243;1.5.7.1;pro;Evidence of extinct species on our own planet (e.g., dinosaurs) is buried beneath the surface. This makes it very hard to find evidence of extinct species on/in other planets/solar systems/galaxies.;['0', '0', '0', '0', '0']; ;3
244;1.5.7.2;pro;The Great Filters response to the Fermi Paradox states that alien life could well exist but may go through iterative cycles of extinction unless they have certain forms of intelligence or advancement.;['0', '0', '0', '0', '0']; 2;3
245;1.5.8;con;To move from the fact that we haven't found definitive proof of aliens to the inference that aliens do not exist is an argument from ignorance.;['0', '0', '0', '0', '0']; 13;2
246;1.5.8.1;pro;Aliens could very well have already visited Earth, but before humans were there or advanced enough to document the event.;['0', '0', '0', '0', '0']; ;3
247;1.5.8.2;pro;Researchers estimate that there are still over 300 undiscovered species of mammals, demonstrating how scientific investigations could fail to discover beings that exist.;['0', '0', '0', '0', '0']; ;3
248;1.5.8.2.1;con;The search for alien life is fundamentally different from the search for life on Earth because the conditions for terrestrial life are well understood, and this is not the case for extraterrestrial conditions for life.;['0', '0', '0', '0', '0']; ;4
249;1.5.8.2.2;con;This argument supports the idea that more scientific research into terrestrial species is needed, and does not provide evidence for the fallibility of scientific research in general.;['0', '0', '0', '0', '0']; 3;4
250;1.5.8.4;pro;Humans have not discovered a fraction of the universe, and therefore the evidence isn't representative at all.;['1', '0', '0', '1', '3']; ;3
251;1.5.8.4.1;pro;As of April 2014, the Habitable Exoplanets Catalog lists 21 planets that have the best chance for life beyond our solar system. These have not yet received sufficient scrutiny to come to any conclusions about the existence of alien life.;['0', '0', '0', '0', '1']; 16;4
252;1.5.8.4.2;pro;"Earth is not visible to all planets; studies have only recently been carried out that assess Earth's discoverability in our solar system.";['0', '0', '0', '0', '0']; 4;4
253;1.5.8.4.2.1;pro;The time span of human existence is so short on the scale of universe, that it is possible that alien life would not overlap with it, or even the existence of the Earth and Solar system.;['0', '0', '0', '0', '0']; 2;5
254;1.5.8.4.3;pro;Humans have only been able to detect alien life or been detectable to aliens, for a minuscule amount of time.;['0', '0', '0', '0', '0']; 2;4
255;1.5.8.4.4;pro;"Previous searches have only covered 5.8 x 10¹? m5Hz2 of the universe's total ""8D haystack"" volume of 6.4 x 10¹¹? m5Hz2. This is a tiny fraction. (To put this in the context of Tarter et al.’s original comparison, the total volume of Earth’s oceans is 1.335 x 1021 liters. Since a cubic meter is 1,000 liters, that’s about the size of a large hot tub.).";['1', '0', '0', '0', '0']; 10;4
256;1.5.8.4.5;con;If in an infinitely large universe, with many possibilities for life to have occurred, life still has not been found - then this may indicate that life is less probable than previously thought.;['0', '0', '0', '0', '0']; ;4
257;1.5.8.4.6;con;To assume that the portion of the universe observed from Earth is not representative of the broader universe is to assume Earth is somehow special, which is contrary to the Copernican principle.;['0', '0', '0', '0', '1']; ;4
258;1.5.8.4.6.1;con;The Copernican principle has not been proven yet.;['0', '0', '0', '0', '0']; 2;5
259;1.5.8.5;con;If a hypothetical statement was true without proof, then any possibly conceivable statement would be true, including its opposite, which is impossible.;['0', '0', '0', '0', '1']; ;3
